prj_title,year,beneficiaries,sector,status,region,implementor,cost
Methane Gas and Organic Fertilizer Recovery as Wastewater Improvement Strategy in the City Slaughterhouse Facility,2021,Local Government Unit - Cagayan de Oro,Other Regional Industry Priorities,On-going,Region X,RO-CONSORTIA,"6,773,808.00"
Micro-Hydro Power Plant,1999,LGU-Bukidnon,Agriculture / Marine / Aquaculture / Forestry / Livestock,On-going,Region X,PSTC-BUKIDNON,0
Monitoring and Evaluation of DOST-8 Regional Operations to Strengthen its Capabilities and Performance,2010,ViFARD,Agriculture / Marine / Aquaculture / Forestry / Livestock,Completed,Region VIII,RO-GIA,"413,350.00"
MSMEs Improved Services and Operations for Competitiveness of Communities thru Food Innovation Convergence (MISOCC-FIC),2020,Northwestern Mindanao State College of Science and Technology (NMSCST),Food Processing,On-going,Region X,PSTC-MISAMIS OCCIDENTAL,"1,900,000.00"
Negros Occidental Metals & Engineering Innovation Center (Phase I),2015,LGU-San Carlos City,Metals & Engineering,Completed,Region VI,PSTC-NEGROS OCCIDENTAL,"1,000,000.00"
"Nutr-I: S&T Intervention through Nutribun and Iron-Fortified Rice for the Improvement of Health and Nutrition Status of the Cauyonan Community in Opol, Misamis Oriental - D2",2020,"70 malnourished and stunted 24-59 months old children; 9 pregnant, and 17 lactating mothers",Other Regional Industry Priorities,On-going,Region X,PSTC-MISAMIS ORIENTAL,"595,007.00"
Operationalization of Food Safety Teams in Eastern Visayas,2012,VSU - Baybay,Other Regional Industry Priorities,Completed,Region VIII,RO-GIA,"165,200.00"
Operationalization of oneStore(Ecommerce Platform for MSMEs),2016,DOST2,Other Regional Industry Priorities,Completed,Region VIII,RO-GIA,"150,000.00"
Operationalizing the technology business Incubator (TBI) for Information Technology-Business Process Management (IT-BPM) Start-up Companies,2019,Ebiz Solution & Supplies,Agriculture / Marine / Aquaculture / Forestry / Livestock,On-going,Region VIII,RO-GIA,"200,000.00"
Process Improvement of Native BAriw Products,2011,Local Government Unit of Nabas,Gifts / Decors / Handicrafts,Completed,Region VI,PSTC-AKLAN,"302,230.00"
Product and Process Improvement of Aurora Blend Coffee,2010,Aurora State College of Technology,Food Processing,Completed,Region III,RO-GIA,"230,000.00"
Product and Process Improvement of Water Hyacinth Based Handcrafts Project for the Women Members of Kabuhayan ng mga Kabarangay Tungo Sa Tagumpay (KKT),2017,Kabuhayan ng mga Kabarangay Tungo Sa Tagumpay (KKT),Gifts / Decors / Handicrafts,Completed,Region III,PSTC-PAMPANGA,"551,000.00"
"Product and Process Improvement with Package Development for Puto Seco, Mammon Tostado and Mamon Sopas",2017,"LGU-Bacolor, Pampanga",Food Processing,Completed,Region III,PSTC-PAMPANGA,"430,263.00"
Product Development (Label and Package Design Enhancement),2010,LGU-Valencia City,Agriculture / Marine / Aquaculture / Forestry / Livestock,On-going,Region X,PSTC-BUKIDNON,0
"Product Development and Technology Intervention for Cacao, Coffee, and other Staple-Based Crops in Gingoog City - D1",2019,Rural Improvement Club (RIS),Food Processing,New,Region X,PSTC-MISAMIS ORIENTAL,"1,908,670.00"
"Product Development through Cacao Processing by Application of Science and Technology Intervention of Mahinog Cacao Producers Group in Mahinog, Camiguin",2018,"LGU-Mahinog, Camiguin",Food Processing,On-going,Region X,PSTC-CAMIGUIN,"479,570.00"
"Production of Charcoal Briquettes from Waste Products to Provide Livelihood To Malaybalay City Federation of Local Councils of Women, Incorporated (MCFLCW) and Improve its Living Condition thru Various S & T Interventions in Can-ayan, Malaybalay City",2020,LGU-Malaybalay City,Agriculture / Marine / Aquaculture / Forestry / Livestock,New,Region X,PSTC-BUKIDNON,"1,408,000.00"
Production of Engineered Bamboo,2015,"San Fernando Crafts Makers Association, Incorporated",Gifts / Decors / Handicrafts,Withdrawn,Region X,PSTC-BUKIDNON,"1,082,000.00"
Production of Interlocking Compressed Earth Block,2013,LGU-Bukidnon,Other Regional Industry Priorities,On-going,Region X,PSTC-BUKIDNON,"656,626.00"
Production of Spirulina Biomass: Refinement of Grow-out Production Technology and Piloting in Northern Mindanao,2019,GreenPastures Corporation,Health & Wellness Products,On-going,Region X,RO-CONSORTIA,"2,983,805.00"
Productivity Enhancement of Squash Canton Noodles Production Facilities and Other Squash-based Product,2016,"Municipality of Barbaza, Antique",Food Processing,On-going,Region VI,PSTC-ANTIQUE,"396,850.00"
"Productivity Improvement of Tablea Production thru Provision of Various Equipment and Other Related S&T Interventions of Catarman Cacao Growers Association in Catarman, Camiguin",2021,Catarman Cacao Growers Association,Food Processing,On-going,Region X,PSTC-CAMIGUIN,"579,400.00"
"PROJECT AQWAH: Advancement on the Quality of Water Available for Household use thru the provision of Cermaic Water Filter in in Sitio Langahan, Sampagar, Damulog and Old Damulog National High School in Damulog, Bukidnon, Philippines – D3",2021,LGU-Damulog,Agriculture / Marine / Aquaculture / Forestry / Livestock,On-going,Region X,PSTC-BUKIDNON,"657,300.00"
"Promoting S&T Culture and Disaster Resilience Through the Provision of Solar-Powered S&T Information Kiosk and Lights in the Evacuation Site in Sagay, Camiguin",2021,"LGU SAGAY, CAMIGUIN, Municipal Disaster Risk Reduction Office - LGU Sagay, Camiguin",Other Regional Industry Priorities,On-going,Region X,PSTC-CAMIGUIN,"1,070,100.00"
"Provision of Ceramic Water Filters to Upper Sitios of Brgy. Kibangay – a GIDA community in Lantapan, Bukidnon D2",2020,LGU Lantapan,Health & Wellness Products,New,Region X,PSTC-BUKIDNON,"113,600.00"
"Provision of Environment Protection and Conservation Equipment in Salay, Misamis Oriental - D1",2019,Local Government Unit of Salay,Agriculture / Marine / Aquaculture / Forestry / Livestock,On-going,Region X,PSTC-MISAMIS ORIENTAL,"238,000.00"
"Provision of Technology Innovation to Subanen Abaca Farmers in GIDA and ELCAC Communities of Sinacaban, Misamis Occidental-D2",2021,"San Lorenzo Ruiz Subanen Farmers Organization, Inc. (SALORUSFAO)",Gifts / Decors / Handicrafts,On-going,Region X,PSTC-MISAMIS OCCIDENTAL,"354,600.00"
Quality Assurance of Lambanog and Nipanog for Consumer Safety and Sustainable Industry,2017,"Nipanog producers of Panukulan, Nipanog producers of Polillo, Lambanog producers of Tayabas, Nipanog producers of Infanta, Nipanog producers of Mauban, Nipanog producers of Burdeos",Food Processing,Completed,Region IV-A,RO-Project Coordinators,"505,998.00"
"Reduction of Malnutrition by Applying Complementary Food Technology thru Complementary Feeding in Guinsiliban, Camiguin",2019,"LGU-Guinsiliban, Camiguin",Other Regional Industry Priorities,Completed,Region X,PSTC-CAMIGUIN,"272,650.00"
"Reduction of Malnutrition by Applying Complementary Food Technology thru Complementary Feeding in Mahinog, Camiguin",2018,"LGU-Mahinog, Camiguin",Health & Wellness Products,On-going,Region X,PSTC-CAMIGUIN,"190,300.00"
"Rehabilitation of Abaca Production in Brgys. Maac and Mahayahay, Sogod, Southern Leyte",2014,Brgys. Maac and Mahayahay,Other Regional Industry Priorities,Completed,Region VIII,RO-GIA,"200,000.00"
"Rehabilitation of Fishery Livelihood of Brgy. Basiao, Ivisan",2014,Ivisan LGU,Agriculture / Marine / Aquaculture / Forestry / Livestock,On-going,Region VI,PSTC-CAPIZ,"561,371.00"
Rehabilitation of Smoke Fish Processing Facility in Sagay City,2014,LGU-Sagay City,Food Processing,Completed,Region VI,PSTC-NEGROS OCCIDENTAL,"500,000.00"
"S&T Based Facility for Cacao Post Harvest Pre-Processing: A Support Facility for the Livelihood Recovery Program of Typhoon Yolanda-Affected Farmers in Quinapondan, Eastern Samar",2017,Local Service Provider Association (LSPA),Food Processing,On-going,Region VIII,PSTC-EASTERN SAMAR,"1,565,500.00"
"S&T Based Facility for High Value Crops Processing: A Support Facility for the Livelihood Recovery Program of Typhoon Yolanda-Affected and Low Income Families in Salcedo, E. Samar",2017,"LGU Salcedo (Women Group, 4Ps and ARBOs)",Agriculture / Marine / Aquaculture / Forestry / Livestock,On-going,Region VIII,PSTC-EASTERN SAMAR,"2,898,800.00"
"S&T Based Facility for Meat Processing: A Support Facility for the Livelihood Recovery Program of Typhoon Yolanda-Affected Women in Mercedes, E. Samar",2017,Buklod ng Kababaihan sa Mercedes,Food Processing,On-going,Region VIII,PSTC-EASTERN SAMAR,"1,809,512.00"
"S&T Based Facility for Veggie Noodles Processing: A Support Facility for the Livelihood Recovery Program of Typhoon Yolanda Affected Low Income Farmers in Hernani, E. Samar",2017,San Miguel Farmers Association,Food Processing,On-going,Region VIII,PSTC-EASTERN SAMAR,"1,741,250.00"
"S&T Based Tuna Fish Processing Facility: A Support Facility for the Livelihood Recovery Program of Typhoon Yolanda-Affected and Low Income Families in Maydolong, E. Samar",2017,LGU Maydolong/ Maydolong FIshermen Association,Food Processing,On-going,Region VIII,PSTC-EASTERN SAMAR,"3,375,800.00"
"S&T Information, Education and Communication Promotional Initiatives in Eastern Visayas",2011,"Philippine Information Agency, Tacloban City",ICT,Completed,Region VIII,RO-GIA,"300,000.00"
S&T Support to Upgrading of Katutubong Asim from Tuba (SUKANG Tuba) Project,2020,Sapang Dalaga Vinegar & Coco Sugar Maker's Association (SAVICOMA),Food Processing,On-going,Region X,PSTC-MISAMIS OCCIDENTAL,"200,662.00"
"Science and technology Innovation Support to Women of Calindanawan Made Real Livelihood Association, Inc.",2017,Calindanawan Made Real Livelihood Association Inc.,Agriculture / Marine / Aquaculture / Forestry / Livestock,Terminated,Region X,PSTC-MISAMIS ORIENTAL,"142,750.00"
Seminar-Workshop on Technology Needs Assessment and R&D for the DOST-HAU Partnership Project,2014,Holy Angel University,Other Regional Industry Priorities,On-going,Region III,PSTC-PAMPANGA,"125,100.00"
Solid Waste Management Biorector Technology,2008,LGU-Camiguin,Other Regional Industry Priorities,Completed,Region X,PSTC-CAMIGUIN,"585,000.00"
Spray Drying of Fruit and Vegetable Juice Blends from Abundant and Underutilized Food Crops in Bukidnon,2021,Central Mindanao University,Food Processing,On-going,Region X,RO-CONSORTIA,"2,999,788.00"
"Stimulating S&T Minds through Provision of STARBOOKS software to GIDA and CAP Dev Identified Areas of ELCAC and CEST Sinacaba, Misamis Occidental-D2",2021,"Gala Elementary School, Owayan Elementary School, San Lorenzo Ruiz Elementary School",ICT,On-going,Region X,PSTC-MISAMIS OCCIDENTAL,"285,500.00"
Strengthening Proposals Review Mechanism of the Small Enterprise Technology Upgrading Program (SET-UP) and other S&T Related Activites in Region 8,2015,Leyte Normal University (LNU),,Completed,Region VIII,RO-GIA,"771,420.00"
"Strengthening Awareness For Effective disaster Response (SAFER) Project in Sinacaban, Misamis Occidental-D2",2021,LGU-Sinacaban (Local Government Unit of Sinacaban),Other Regional Industry Priorities,On-going,Region X,PSTC-MISAMIS OCCIDENTAL,"209,400.00"
"Strengthening Capacities of Eastern Visayas Consortium for Industry, Energy and Emerging Technology Research and Development (EVCIEERD)",2019,"EVCIEERD, TWG Members and Researchers of SuCs in Region 8, DOST8",,On-going,Region VIII,RO-GIA,"272,500.00"
Strengthening Community Empowerment thru Science and Technology Project Management in Region 8,2017,SLSU-CAALS,,Completed,Region VIII,RO-GIA,"425,000.00"
Strengthening Disaster Awareness for Emerging Tragedies (SAFETY) Project,2020,LGU-Aloran,Other Regional Industry Priorities,On-going,Region X,PSTC-MISAMIS OCCIDENTAL,"108,800.00"
"Strengthening Food Processing and Innovation Center of NMSCST through the Establishment of Shelf-Life Testing Laboratory in Tangub City, Misamis Occidental-D2",2021,Northwestern Mindanao State College of Science and Technology (NMSCST),Other Regional Industry Priorities,On-going,Region X,PSTC-MISAMIS OCCIDENTAL,"2,980,000.00"
"Strengthening Government-Industry-Academe Collaboration through the Northern Mindanao Consortium for Industry, Energy, and Emerging Technology Research and Development (NorMinCIEERD)",2022,DOST-X Regional Office,ICT,On-going,Region X,RO-CONSORTIA,"873,830.00"
"Strengthening of Livelihood thru Provision of Fishing Gears to Dampias Fisherfolk Association in Binuangan, Misamis Oriental-D1",2019,"LGU-Binuangan, Misamis Oriental",Agriculture / Marine / Aquaculture / Forestry / Livestock,On-going,Region X,PSTC-MISAMIS ORIENTAL,"299,000.00"
"Strengthening Product Competitiveness of Oroquieta City Agriculture Cooperative, D-1 Misamis Occidental through various S&T interventions",2021,Oroquieta City Agriculture Cooperative,Food Processing,On-going,Region X,PSTC-MISAMIS OCCIDENTAL,"368,075.00"
Strengthening Proposals Review Mechanism and Implementation of SETUP and other S&T Activities in the Region VIII,2012,Leyte Chamber of Commerce and Industry,,Completed,Region VIII,RO-GIA,"794,900.00"
Strengthening Proposals Review Mechanism and Implementation of SETUP and other S&T Activities in the Region VIII (Phase II),2013,Leyte Chamber of Commerce and Industry,,Completed,Region VIII,RO-GIA,"971,417.00"
Strengthening Proposals Review Mechanism and Implementation of SETUP and other S&T Activities in the Region VIII (Phase III),2014,Leyte Chamber of Commerce and Industry,,Completed,Region VIII,RO-GIA,"1,000,000.00"
Strengthening Proposals Review Mechanism and Implementation of the Small Enterprise Technology Upgrading Program (SETUP) and Other S&T Related Activities in Region 8,2016,Leyte Normal University (LNU),,Completed,Region VIII,RO-GIA,"337,884.00"
Strengthening Proposals Review Mechanism and Implementation of the Small Enterprise Technology Upgrading Program (SETUP) and Other S&T Related Activities in Region 8 (Phase II),2017,Leyte Normal University (LNU),,Completed,Region VIII,RO-GIA,"600,000.00"
"Strengthening S&T Services for Micro, Small and Medium Enterprises (MSMEs) in Eastern Visayas (Sub-project II: Regional Food Innovation Center Phase I-Y2)",2015,EVSU - Tacloban,,Completed,Region VIII,RO-GIA,"1,000,000.00"
"Strengthening S&T Services for Micro, Small and Medium Enterprises (MSMEs) in Eastern Visayas (Sub-project II: Regional Food Innovation Center Phase I-Y3)",2016,EVSU - Tacloban,,Completed,Region VIII,RO-GIA,"640,000.00"
"Strengthening S&T Services for Micro, Small and Medium Enterprises (MSMEs) in Eastern Visayas (Sub-project II: Regional Food Innovation Center Phase I)",2014,EVSU - Tacloban,,Completed,Region VIII,RO-GIA,"500,000.00"
"Strengthening S&T Services for Micro, Small and Meduim Enterprises (MSMEs) in Eastern Visayas, Sub-Project II: (Regional Food Innovation Center Phase II-Y1)",2017,EVSU - Tacloban,,Completed,Region VIII,RO-GIA,"1,000,000.00"
"Strengthening S&T Services for Micro, Small and Meduim Enterprises (MSMEs) in Eastern Visayas, Sub-Project II: (Regional Food Innovation Center Phase II-Y2)",2018,EVSU - Tacloban,,On-going,Region VIII,RO-GIA,"1,200,000.00"
Strengthening S&T Services for MSMEs in Eastern Visayas Sub-Project 1: Enhancing Analytical and Calibration Services to Improve Competitiveness of MSMEs (Phase I-Y2),2013,EVSU - Tacloban,,Completed,Region VIII,RO-GIA,"430,000.00"
Strengthening S&T Services for MSMEs in Eastern Visayas Sub-Project 1: Enhancing Analytical and Calibration Services to Improve Competitiveness of MSMEs (Phase I),2012,EVSU - Tacloban,,Completed,Region VIII,RO-GIA,"606,452.00"
Strengthening S&T Services for MSMEs in Eastern Visayas Sub-Project 1: Enhancing Analytical and Calibration Services to Improve Competitiveness of MSMEs (Phase II-Y1),2014,EVSU - Tacloban,,Completed,Region VIII,RO-SETUP,"419,821.00"
Strengthening S&T Services for MSMEs in Eastern Visayas Sub-Project 1: Enhancing Analytical and Calibration Services to Improve Competitiveness of MSMEs (Phase II-Y2),2015,EVSU - Tacloban,,Completed,Region VIII,RO-GIA,"650,000.00"
Strengthening S&T Services for MSMEs in Eastern Visayas Sub-Project 1: Enhancing Analytical and Calibration Services to Improve Competitiveness of MSMEs (Phase II-Y3),2016,EVSU - Tacloban,,Completed,Region VIII,RO-GIA,"360,000.00"
Strengthening S&T Services for MSMEs in Eastern Visayas Sub-Project 1: Enhancing Analytical and Calibration Services to Improve Competitiveness of MSMEs (Phase III-Y1),2017,EVSU - Tacloban,,Completed,Region VIII,RO-GIA,"550,000.00"
Strengthening S&T Services for MSMEs in Eastern Visayas Sub-Project 1: Enhancing Analytical and Calibration Services to Improve Competitiveness of MSMEs (Phase III-Y2),2018,EVSU - Tacloban,,On-going,Region VIII,RO-GIA,"600,000.00"
"Strengthening Silk Production in Malaybalay City to Improve Sustainability and Competency thru various S&T Interventions in Brgy. Can-ayan, Malaybala City, Bukidnon D-2.",2018,LGU-Malaybalay City,Agriculture / Marine / Aquaculture / Forestry / Livestock,On-going,Region X,PSTC-BUKIDNON,0
Strengthening the Capacity of the Regional and Provincial Disaster Risk Reduction and Management Council on Provision of Science-based Info Hazard Mitigation (Phase 1),2014,DOST8,,Completed,Region VIII,RO-GIA,"591,155.00"
Strengthening the Food Industry Towards Food Standards,2013,Philippine Chamber of Commerce and Industry-CAR,Other Regional Industry Priorities,Completed,CAR,RO-GIA,"710,000.00"
Strengthening the Operations and Capability Building of the Food Innovation Center (FIC),2016,Guimaras State College (GSC),Agriculture / Marine / Aquaculture / Forestry / Livestock,Completed,Region VI,PSTC-GUIMARAS,"3,476,807.00"
Strengthening the Provision of Food Safety Services to MSMEs in Eastern Visayas,2014,VSU - Baybay,Food Processing,Completed,Region VIII,RO-GIA,"290,000.00"
Strengthening the Provision of Food Safety Services to MSMEs in Eastern Visayas - Phase 3,2017,Samar State University,Other Regional Industry Priorities,On-going,Region VIII,RO-GIA,"200,000.00"
"Strengthening the Research, Development and Extension Capability of STCIERD Member-Agencies",2019,Southern Tagalog Consortium for Industry and Energy Research and Development,Agriculture / Marine / Aquaculture / Forestry / Livestock,New,Region IV-A,RO-Project Coordinators,"1,000,000.00"
"Strengthening Tribal Community-based Brick Production to Improve Technical Skills and Livelihood for IP Community and Settlers thru Enhancement Training Cum Production in Songco, Lantapan, Bukidnon",2018,LGU Lantapan,Other Regional Industry Priorities,On-going,Region X,PSTC-BUKIDNON,"203,000.00"
Support Facility for the Food Processing Sector of the Province of Negros Occidental,2012,LGU - Province of Negros Occidental,Food Processing,Completed,Region VI,PSTC-NEGROS OCCIDENTAL,0
Support to Clean Camiguin Covid19 QR Code System and its Operation Center through the adoption of S-PaSS and other Covid-related Systems,2021,PROVINCIAL GOVERNMENT UNIT (PGO) CAMIGUIN - Provincial Planning Development Office,ICT,Completed,Region X,PSTC-CAMIGUIN,"480,000.00"
"Support to Information Technology Enhancement: A CEST e-Governance Project in Salay, Misamis Oriental- D1",2018,"LGU-Salay, Misamis Oriental",ICT,On-going,Region X,PSTC-MISAMIS ORIENTAL,"64,000.00"
"Support to Response and Alert System: A DOST CEST DRRM Project in Catarman, Camiguin",2021,Municipal Disaster Risk Reduction Office - LGU Catarman,Other Regional Industry Priorities,On-going,Region X,PSTC-CAMIGUIN,"992,062.00"
Support to Strengthen the Implementation of One Lab in Negros Occidental,2018,Negros Prawn Producers Cooperative (NPPC),Other Regional Industry Priorities,On-going,Region VI,PSTC-NEGROS OCCIDENTAL,0
Support to the Association of Negros Producers OURFood Agenda,2012,"Association of Negros Producers (ANP), Inc.",Food Processing,Completed,Region VI,PSTC-NEGROS OCCIDENTAL,0
Support to VCO Industry Tool Packaging for VCO,2017,Maanda Farmers and Fisherfolks Association (MFFA),Other Regional Industry Priorities,On-going,Region VIII,PSTC-LEYTE,"972,200.00"
Supporting the Operations Function of NMFIC in Strengthening Innovations and Capabilities of the MSMEs of Northern Mindanao,2019,"University of Science and Technology of Southern Philippines, Northern Mindanao Food Innovation Center (NMFIC)",Food Processing,On-going,Region X,PSTC-MISAMIS ORIENTAL,"599,101.00"
Sustainable Community-based Vegetable Intensive and Efficient Technology-Driven Production Systems (Sustainable Vegies) for Bukid Kabataan Center,2020,DOST-PSTC Cavite,Agriculture / Marine / Aquaculture / Forestry / Livestock,On-going,Region IV-A,PSTC-CAVITE,"4,500,000.00"
Technical Assistance on Laboratory Testing/Analyses for Selected MSMEs,2018,"Casile-Guinting Upland Marketing Cooperative, Pidiong's House of Cashew Nuts, Momilo Mio Food Venture, Zenaida Corcuera Food Product, Aga Farmers Cooperative, Candelaria Coconut (OTOP) & Other Manufacturers' Association, Inc. (CACOPMAI)",Food Processing,On-going,Region IV-A,RO-Project Coordinators,"217,000.00"
Technology Innovation Support to Kapatagan Lampakanay Handicrafts Association (Kaplaha) through Provision of Various Equipment to Upgrade the Production of Lampakanay Handicrafts,2017,Kapatagan Lampakanay Handicrafts Association (Kaplaha),Gifts / Decors / Handicrafts,Terminated,Region X,PSTC-LANAO DEL NORTE,"250,000.00"
"Technology Innovation Support to Magsaysay Multipurpose Cooperative thru Provision of Geo-Textile/Coco net Weaving, Twining Machines and Package of Training Assistance to Lanao del Norte-D2",2015,Magsaysay Multi-Purpose Cooperative,Other Regional Industry Priorities,Completed,Region X,PSTC-LANAO DEL NORTE,"324,900.00"
"Technology Intervention in Binuangan, Misamis Oriental - D1 to produce Eco-Hollow Blocks from Shredded Solid Waste",2019,"LGU-Binuangan, Misamis Oriental",Other Regional Industry Priorities,New,Region X,PSTC-MISAMIS ORIENTAL,"699,000.00"
"Technology Intervention through the Provision of Green Charcoal Briquette Processing Facility: an LGIA Project in Balingasag, Misamis Oriental-D1",2019,LGU-Balingasag,Agriculture / Marine / Aquaculture / Forestry / Livestock,On-going,Region X,PSTC-MISAMIS ORIENTAL,"372,599.00"
"Technology Provision to Public High Schools and Enrichment Program for Graduating Senior High School Students from Binuangan, Misamis Oriental-D1",2019,"LGU-Binuangan, Misamis Oriental",Agriculture / Marine / Aquaculture / Forestry / Livestock,On-going,Region X,PSTC-MISAMIS ORIENTAL,"233,800.00"
Technology Support for Coco Coir and Peat Processing Facility,2020,"Linamon Coconut Farmers Association, LGU Linamon",Agriculture / Marine / Aquaculture / Forestry / Livestock,On-going,Region X,PSTC-LANAO DEL NORTE,"800,000.00"
"Technology Support for the Establishment of Dairy Processing Facility in Brgy. Abuno, Iligan City",2019,"LGU-Iligan, Sentro sa Maayong Magbalantay, Inc.",Food Processing,On-going,Region X,PSTC-LANAO DEL NORTE,"238,000.00"
"Technology Support for the Establishment of Seaweeds Post-harvest Facility in Kolambugan, LDN-D2",2020,Simbuco Aqua-Marine Multi Purpose Cooperative,Food Processing,On-going,Region X,PSTC-LANAO DEL NORTE,"458,950.00"
"Technology Support thru Provision of Waste Shredding Machines and Dual Drum Composter for Waste Management of Iligan City, Lone District",2020,LGU Iligan,Other Regional Industry Priorities,On-going,Region X,PSTC-LANAO DEL NORTE,"501,600.00"
Technology Training on Bamboo Furniture and Handicraft Production,2017,"LGU-Bonifacio, Misamis Occidental",Furniture,Terminated,Region X,PSTC-MISAMIS OCCIDENTAL,"129,406.00"
Technology Training on Engineered Bamboo Production,2015,LGU-Sapang Dalaga,Furniture,Completed,Region X,PSTC-MISAMIS OCCIDENTAL,"60,000.00"
Technology Training on Lampakanay Handicrafts Preservation and Finishing Techniques,2015,Kapatagan Lampakanay Handicrafts Association (Kaplaha),Agriculture / Marine / Aquaculture / Forestry / Livestock,Completed,Region X,PSTC-LANAO DEL NORTE,"60,800.00"
Technology Training on Squash Canton Noodle Processing,2014,KATUPARAN,Food Processing,Completed,Region X,PSTC-MISAMIS OCCIDENTAL,"47,000.00"
"Technology Training on Squash Canton Noodle Processing of Tinaclaan Rural Improvement Club in Clarin, Misamis Occidental D-2",2019,"LGU-Clarin, Tinaclaan Rural Improvement Club",Food Processing,On-going,Region X,PSTC-MISAMIS OCCIDENTAL,"50,000.00"
Technology Training on Turmeric Processing,2017,LGU-Tangub City,Food Processing,Terminated,Region X,PSTC-MISAMIS OCCIDENTAL,"15,000.00"
Technology Upgrading for Manufacturing Efficiency for Rural Improvement Club-Malibacsan Inc. (TURMERIC-Malibacsan) Project,2020,LGU-Jimenez,Food Processing,On-going,Region X,PSTC-MISAMIS OCCIDENTAL,"345,200.00"
"Technology Upgrading for the Production of Gifts, Novelties, and Souvenir Items",2011,Shamara Industries,Gifts / Decors / Handicrafts,Completed,Region X,PSTC-BUKIDNON,"111,316.00"
"Technology Upgrading of Dried Sardines Processing Facilities in Salay, Misamis Oriental - D1",2019,Local Government Unit of Salay,Agriculture / Marine / Aquaculture / Forestry / Livestock,On-going,Region X,PSTC-MISAMIS ORIENTAL,"271,000.00"
The Beneficial Effects of Virgin Coconut Oil (VCO) among Suspect and Probable Cases of COVID-19,2020,Department of Science and Technology - Food and Nutrition Research Institute (DOST-FNRI),Health & Wellness Products,Completed,Region IV-A,RO-Project Coordinators,"7,101,781.00"
Training Course on Research and Development (R&D) Project Implementation Management,2019,DOST8,Agriculture / Marine / Aquaculture / Forestry / Livestock,On-going,Region VIII,RO-GIA,"240,000.00"
"Training cum Production of 1.5L Ceramic Pot Filters for the Water Purification Filtration System in Eliano Baluyut Pottery, Inc. (Technology Transfer) – Phase II",2013,Eliano Baluyut Pottery Inc.,Other Regional Industry Priorities,Completed,Region III,PSTC-PAMPANGA,"186,250.00"
Training on Upholstery for the Pampanga Furniture Industry,2017,Don Honorio Ventura Technological State University,Furniture,Completed,Region III,PSTC-PAMPANGA,"220,000.00"
