prj_title,year,beneficiaries,sector,status,region,implementor,cost
Training Workshop on Fermentation of Various Food Products in Misamis Oriental,2019,LGU-Misamis Oriental,Food Processing,Completed,Region X,PSTC-MISAMIS ORIENTAL,"47,414.00"
Transfer of Pulled Out Equipment to USTP-Oroquieta for its Food Research Development Project,2017,USTP-Oroquieta City,Food Processing,Completed,Region X,PSTC-MISAMIS OCCIDENTAL,"624,098.00"
"Tree Nursery Project and Provision of Solar Water Pump for Environmental Protection and Climate Change Adaptation in Gitagum, Misamis Oriental-D2",2020,LGU-Gitagum,Agriculture / Marine / Aquaculture / Forestry / Livestock,On-going,Region X,PSTC-MISAMIS ORIENTAL,"399,750.00"
University of the Philippines Visayas Small Enterprise and Entrepreneurial Development Services -Technology Business Incubator (UPV SEEDS-TBI),2011,University of the Philippines Visayas,Other Regional Industry Priorities,Completed,Region VI,PSTC-ILOILO,"1,320,000.00"
Upgrading and Mechanization of Organic Fertilizer Production,2003,LGU-Bukidnon,Agriculture / Marine / Aquaculture / Forestry / Livestock,On-going,Region X,PSTC-BUKIDNON,0
"Upgrading Bamboo Processing Facility of Sto. Niño Multi-Purpose Cooperative, Catarman, Camiguin",2020,STO. NI?'O MULTI PURPOSE COOPERATIVE,Furniture,On-going,Region X,PSTC-CAMIGUIN,"448,450.00"
Upgrading of a Community Based Salt Iodizing Facility for San Lorenzo Salt Producers,2012,LGU- San Lorenzo,Agriculture / Marine / Aquaculture / Forestry / Livestock,Completed,Region VI,PSTC-GUIMARAS,"252,505.00"
Upgrading of a Complementary Food Facility of Jordan LGU to Reduce Malnutrition in the Province of Guimaras,2013,LGU-Jordan,Food Processing,Completed,Region VI,PSTC-GUIMARAS,"452,196.00"
Upgrading of Aklan Food an Water Testing LAboratory - Phase II,2012,Provincial Government of Aklan,Food Processing,On-going,Region VI,PSTC-AKLAN,"1,182,350.00"
"Upgrading of Banana Chip Processing Facility in Barangay 95-A, Tacloban, City, Leyte",2017,Womens Economic Sustainable Dev't Association (WESDA),Food Processing,On-going,Region VIII,PSTC-LEYTE,"970,000.00"
"Upgrading of Banana Chips Processing of LGU-Malitbog, Bukidnon",2017,LGU-Malitbog,Other Regional Industry Priorities,On-going,Region X,PSTC-BUKIDNON,"438,810.00"
"Upgrading of Brick Production for IP Women in Songco, a GIDA community, in Lantapan, Bukidnon –D2",2020,LGU Lantapan,Gifts / Decors / Handicrafts,New,Region X,PSTC-BUKIDNON,"171,000.00"
"Upgrading of Community Food Processing Facility in Brgy. Baybay, Alubijid, Misamis Oriental – D2",2020,Alubijid Foods Inc. (AFI),Food Processing,On-going,Region X,PSTC-MISAMIS ORIENTAL,"606,800.00"
Upgrading of Dried Squid Protection Center through the Provision of Vacuum Packaging Machine,2014,"LGU Oroquieta, Canubay Dried Squid Association (CDSA)",Food Processing,Completed,Region X,PSTC-MISAMIS OCCIDENTAL,"228,390.00"
"Upgrading of EVFIC: Acquisition of Spray Dryer Equipment for Toll Manufacturing Services Eastern Visayas State University (EVSU) Main Campus, Salazar St., Quarry Distric, Tacloban City",2020,EVSU - Tacloban,,On-going,Region VIII,RO-GIA,"1,200,000.00"
Upgrading of Furniture Manufacturing,2019,LGU-Valencia City,Agriculture / Marine / Aquaculture / Forestry / Livestock,On-going,Region X,PSTC-BUKIDNON,0
Upgrading of Green Rose Herbal Oil and Granules Herbal Tea Processing,2014,Saint John the Baptist Herbal Making Processing,Health & Wellness Products,Completed,Region X,PSTC-MISAMIS OCCIDENTAL,"87,518.00"
"Upgrading of Healthy Food Processing Facility to Increase Productivity and Improve Product Quality in Xavier de Kibangay High School – a GIDA, RTF-ELCAC Area, thru Various S&T Intervention in Lantapan Bukidnon, D-2.",2020,LGU Lantapan,Food Processing,New,Region X,PSTC-BUKIDNON,"152,900.00"
"Upgrading of Organic Fertilizer Production Utilizing Vermiculture Technology in Catarman, Camiguin",2021,"LGU CATARMAN, Municipal Agriculture Office - LGU Catarman",Agriculture / Marine / Aquaculture / Forestry / Livestock,On-going,Region X,PSTC-CAMIGUIN,"812,940.00"
"Upgrading of Production Facilities and Packaging Development for Miniature Boat Makers of Rizal, Buenavista",2012,LGU-Buenavista,Agriculture / Marine / Aquaculture / Forestry / Livestock,Completed,Region VI,PSTC-GUIMARAS,"294,407.00"
Upgrading of Quail Egg Production,2019,LGU-Bukidnon,Agriculture / Marine / Aquaculture / Forestry / Livestock,On-going,Region X,PSTC-BUKIDNON,0
"Upgrading of the Charcoal Making Industry in Sibalom, Antique",2016,"Municipality of Sibalom, antique",Other Regional Industry Priorities,On-going,Region VI,PSTC-ANTIQUE,"267,900.00"
"Upgrading of the Common Service Facilities of Banana Chips Production of San Jose Banana Chips Association Through Various Science and Technology Interventions in San Jose, Mahinog, Camiguin",2018,"LGU-Mahinog, Camiguin",Food Processing,On-going,Region X,PSTC-CAMIGUIN,"183,670.00"
Upgrading of the Library Facilities of Don Honorio Ventura Technological State University through the Introduction of Science and Technology Academic and Research-Based Openly-Operated Kiosks (STARBOOKS),2016,Don Honorio Ventura Technological State University,Other Regional Industry Priorities,Completed,Region III,PSTC-PAMPANGA,"181,556.00"
Upgrading of the Library Facilities of Florida National Agricultural School through the Introduction of Science and Technology Academic and Research-Based Openly-Operated Kiosks (STARBOOKS),2017,Floridablanca National Agricultural School,Other Regional Industry Priorities,Completed,Region III,PSTC-PAMPANGA,"166,755.00"
Upgrading of the Library Facilities of San Esteban National High School through the Introduction of Science and Technology Academic and Research-Based Openly-Operated Kiosks (STARBOOKS),2017,"Municipality of Macabebe, Pampanga",Other Regional Industry Priorities,Completed,Region III,PSTC-PAMPANGA,"166,755.00"
Upgrading of the Library Facilities of Tarik Suliman High School through the S&T Academic and Research-Based Openly Operated Kiosks (STARBOOKS),2016,"Municipality of Masantol, Pampanga",Other Regional Industry Priorities,Completed,Region III,PSTC-PAMPANGA,"166,755.00"
Upgrading of the Library Facilities of the Pampanga Provincial Library through the Introduction of Science and Technology Academic and Research-Based Openly-Operated Kiosks Station (STARBOOKS),2017,Pampanga Provincial Library,Other Regional Industry Priorities,Completed,Region III,PSTC-PAMPANGA,"166,755.00"
Upgrading of Water Hyacinth-based Handicrafts,2013,LGU-Maramag,Gifts / Decors / Handicrafts,Terminated,Region X,PSTC-BUKIDNON,"749,998.00"
Upgrading the Capabilities of FNAS as an Avenue for Education and Training through Appropriate S&T Intervention,2017,Floridablanca National Agricultural School (FNAS),Other Regional Industry Priorities,Completed,Region III,PSTC-PAMPANGA,"970,000.00"
Upgrading the NPPC Laboratory Facilities to Support the Natural Products Secto,2012,Negros Prawn Producers Cooperative (NPPC),Other Regional Industry Priorities,Completed,Region VI,PSTC-NEGROS OCCIDENTAL,0
Upgrading the Smoked Fish Processing Facilities of 25 SK ( Samahan ng Kababaihan ) and Packaging Development,2021,25 SK,Agriculture / Marine / Aquaculture / Forestry / Livestock,Completed,Region III,PSTC-ZAMBALES,"150,000.00"
Upgrading the Wine Processing of PSMMMPC (Pinagkaisang Samahan ng Mangingisda at Magsasaka MPC ),2020,Pinagkaisang Samahan ng Magsasaka/ Mangingisda Multi-Purpose Cooperative (PSMM-MPC),Food Processing,Completed,Region III,PSTC-ZAMBALES,"125,000.00"
"Upgrading through S&T Intervention on the Production of Banana and Citronella Oil Based Products: A Business Enterprise Support for the G.Pelaez Agrarian Reform Beneficiaries Multi-Purpose Cooperative (GPARB MPC) at Gitagum, Misamis Oriental",2020,Gregorio Pelaez Agrarian Reform Beneficiaries Multi-Purpose Cooperative (GPARBMPC),Agriculture / Marine / Aquaculture / Forestry / Livestock,On-going,Region X,PSTC-MISAMIS ORIENTAL,"998,780.00"
"Upscaling of Tissue Cultured Production for Abaca, Banana and other High Value Crops for Upland Farmers and Indigenous Peoples in Geographically in Conflict Development Areas (GIDA) of Misamis Oriental",2019,Provincial Local Government of Misamis Oriental - Provincial Agriculture Office (PGMO-PAGRO),Agriculture / Marine / Aquaculture / Forestry / Livestock,On-going,Region X,PSTC-MISAMIS ORIENTAL,"1,860,000.00"
"Upscalling of Tissue Culture Production for Abaca, Banana, and other High Value Crops for Upland Farmers and Indigenous Peoples in Geographically in Conflict Development Areas (GIDA) of Misamis Oriental",2019,Provincial Local Government of Misamis Oriental - Provincial Agriculture Office (PGMO-PAGRO),Agriculture / Marine / Aquaculture / Forestry / Livestock,New,Region X,PSTC-MISAMIS ORIENTAL,"1,860,000.00"
"USEfor Silk: utilization of Sericulture Farming in Sitio Buracan, Brgy. Pagalungan, CDOC-D1",2021,LGU Cagayan de Oro City/Ganda Farming Chapter,Agriculture / Marine / Aquaculture / Forestry / Livestock,New,Region X,PSTC-MISAMIS ORIENTAL,"242,150.00"
"Utilization of an Efficient DOST-Based Technology in Enhancing DRRM Flood Warning Capability in Brgy. Umagos, Lagonglong, Misamis Oriental – D1",2021,LGU-Lagonglong,Other Regional Industry Priorities,On-going,Region X,PSTC-MISAMIS ORIENTAL,"243,572.00"
"Utilization of an Efficient Flood Warning Technology with Pressure-type Water Level Sensor in Brgy. Ili-Ilihon, Salay, Misamis Oriental – D1",2021,"LGU-Salay, Misamis Oriental",Other Regional Industry Priorities,On-going,Region X,PSTC-MISAMIS ORIENTAL,"828,572.00"
Utilization of DOST-FNRI Complementary Food Technology for Improved Nutritional Status of Malnourished Children in GIDA communities of Misamis Occidental,2021,514 malnourished young children from 13 municipalities and cities in Misamis Occidental,Other Regional Industry Priorities,On-going,Region X,PSTC-MISAMIS OCCIDENTAL,"457,040.00"
"Utilization of DOST-FNRI Food Technology to Improve the Nutrition of Children in ELCAC Communities of Tangub City, Misamis Occidental-D2",2021,574 young children ages of 6-36 months old,Other Regional Industry Priorities,On-going,Region X,PSTC-MISAMIS OCCIDENTAL,"785,135.00"
Utilization of Enhanced Patient Transport Vehicle for Safer & More Effective COVID Patient Handling,2021,Local Government Unit of Salay,Agriculture / Marine / Aquaculture / Forestry / Livestock,On-going,Region X,PSTC-MISAMIS ORIENTAL,"571,200.00"
Utilization of Enhanced Patient Transport Vehicle for Safer & More Effective COVID Patient Handling,2021,Local Government Unit of Salay,Health & Wellness Products,On-going,Region X,PSTC-MISAMIS ORIENTAL,"571,200.00"
"Utilization of FNRI Food Technologies for the Improvement of Health Status Among 6-59 Months Old Children in Libertad, Misamis Oriental-D2",2021,Local Government Unit of Libertad,Health & Wellness Products,On-going,Region X,PSTC-MISAMIS ORIENTAL,"329,400.00"
"Utilization of FNRI Food Technology for the Reduction of Malnutrition Status Among 6059 months old in Balingoan, Misamis Oriental-D1",2021,Local Government Unit of Balingoan,Health & Wellness Products,On-going,Region X,PSTC-MISAMIS ORIENTAL,"291,900.00"
"Utilization of Improved Technologies on Processing of Camote and Processed Meat Products of Subanen Women Community in the ELCAC and GIDA Barangays in Tudela, Misamis Occidental-D2",2021,Tinaburan Subanen Tudela Misamis Occidental Incorporated,Food Processing,On-going,Region X,PSTC-MISAMIS OCCIDENTAL,"555,600.00"
Utilization of Solar Assisted Pyrolysis in the Conversion of Plastic Waste into Fuel,2021,Best Agri-Products Processing Cooperative (BAPPCO) and Carbon Cycle Inc.,Metals & Engineering,On-going,Region X,RO-CONSORTIA,"2,014,194.00"
"Utilizing the DOST-MIRDC Electric Potter's Wheel and Jigger and Jolly machine Science & Technology Innovation to Upgrade the Clay Pots and Bricks Making Facility of Provincial Ceramic Center in Baroy, LDN D-1",2021,Provincial Government of Lanao del Norte,Gifts / Decors / Handicrafts,On-going,Region X,PSTC-LANAO DEL NORTE,"613,300.00"
Vermicomposting Technology,2008,Camiguin Polytechnic State College,Agriculture / Marine / Aquaculture / Forestry / Livestock,On-going,Region X,PSTC-CAMIGUIN,"50,000.00"
"Visayas Information Communication Technology Organization (VICTOR) Conference of the Regional Development Council (RDC) 6, 7, 8 with the ICT Councils",2012,Iloilo Federation for Information Technology (IFIT) Inc.,ICT,Completed,Region VI,PSTC-ILOILO,"73,400.00"
"Water Contamination Eradication to Reduce Contamination-related Health Cases in Barangay Kibangay through the Provision of Communal Water Purifier Technology in Barangay Kibangay, Lantapan, Bukidnon",2018,LGU Lantapan,Health & Wellness Products,Completed,Region X,PSTC-BUKIDNON,"212,585.00"
